{
  "$schema": "http://json-schema.org/draft-07/schema#",
  "$id": "https://github.com/jeyantx/jw-timeline/schema/series.schema.json",
  "title": "Timeline Series",
  "description": "A curated, ordered group of timeline records that belong together and should be highlighted together on the chart: a prophecy and its fulfillments, the world powers of Daniel, a succession of kings, the covenants, etc. Members reference event ids from data/raw, data/derived or data/merged. See docs/DATA_SCHEMA.md §10.",
  "type": "object",
  "required": ["id", "title_en", "kind", "description_en", "sources", "members"],
  "properties": {
    "id": {"type": "string", "pattern": "^[a-z0-9-]+$", "description": "Stable kebab-case id, e.g. 'promised-offspring'"},
    "title_en": {"type": "string"},
    "title_ta": {"type": ["string", "null"], "description": "Only text copied from a Tamil jw.org page"},
    "kind": {"type": "string", "enum": ["prophecy_fulfillment", "time_prophecy", "world_powers", "succession", "lineage", "covenants", "chart_reproduction", "theme"]},
    "description_en": {"type": "string", "description": "2-4 sentences explaining what the series shows, faithful to the sources"},
    "description_ta": {"type": ["string", "null"]},
    "highlight": {"type": "boolean", "description": "true = give this series its own colour on the chart by default"},
    "auto": {"type": "boolean", "description": "true = generated by scripts/build_series.py from existing data; do not hand-edit"},
    "parent_series": {"type": ["string", "null"], "description": "Series this one belongs under, e.g. 'kings-of-judah' under 'prophets-and-kings-a6'"},
    "sources": {"type": "array", "minItems": 1, "items": {"$ref": "event.schema.json#/properties/sources/items"}},
    "images": {"type": "array", "items": {"$ref": "event.schema.json#/properties/images/items"}},
    "groups": {
      "type": "array",
      "description": "Optional sub-groups inside the series, e.g. each world power with its prophetic symbols, each covenant with its parties.",
      "items": {
        "type": "object",
        "required": ["id", "label_en"],
        "properties": {
          "id": {"type": "string", "pattern": "^[a-z0-9-]+$"},
          "order": {"type": "integer"},
          "label_en": {"type": "string"},
          "label_ta": {"type": ["string", "null"]},
          "span_id": {"type": ["string", "null"], "description": "The span record that represents this group on the timeline, e.g. the 'Babylon, third world power' span"},
          "symbols": {
            "type": "array",
            "items": {
              "type": "object",
              "required": ["scripture", "symbol_en"],
              "properties": {
                "scripture": {"type": "string", "description": "e.g. 'Dan. 2:32, 36-38'"},
                "symbol_en": {"type": "string", "description": "e.g. 'head of gold'"},
                "symbol_ta": {"type": ["string", "null"]}
              }
            }
          },
          "attributes": {"type": "object", "description": "Free key/value facts printed by the source for this group, e.g. {\"parties\": \"Jehovah and Abraham\", \"purpose\": \"...\"}"},
          "note": {"type": ["string", "null"]}
        }
      }
    },
    "members": {
      "type": "array",
      "minItems": 1,
      "items": {
        "type": "object",
        "required": ["event_id", "order", "role"],
        "properties": {
          "event_id": {"type": "string", "description": "id of a record (point or span) in the timeline"},
          "order": {"type": "number", "description": "Position in the series (1, 2, 3…). Not necessarily chronological, e.g. prophecy then fulfillment."},
          "role": {"type": "string", "enum": ["prophecy", "fulfillment", "partial_fulfillment", "future_fulfillment", "step", "rise", "fall", "ruler", "item", "start", "end", "context"]},
          "group": {"type": ["string", "null"], "description": "groups[].id this member belongs to"},
          "label_en": {"type": ["string", "null"], "description": "Short caption for this member inside the series, as the source words it (e.g. 'Jehovah promises to raise up an offspring')"},
          "label_ta": {"type": ["string", "null"]},
          "pairs_with": {"type": "array", "items": {"type": "string"}, "description": "For prophecy members: the event ids of their fulfillments (and vice versa)"},
          "scriptures": {"type": "array", "items": {"type": "string"}, "description": "Scripture refs specific to this step, e.g. ['Gen. 3:15']"},
          "source_docid": {"type": ["string", "null"], "description": "docid of the series source that puts this member in the series"},
          "note": {"type": ["string", "null"]}
        }
      }
    },
    "notes": {"type": ["string", "null"]}
  }
}
