{
 "id": "kings-of-judah",
 "title_en": "Kings of Judah",
 "title_ta": null,
 "kind": "succession",
 "description_en": "The kings of the southern two-tribe kingdom of Judah, 997–607 B.C.E., in the order of NWT Appendix A6.",
 "description_ta": null,
 "highlight": false,
 "auto": true,
 "parent_series": "prophets-and-kings-a6",
 "sources": [
  {
   "docid": "1101990130",
   "publication": "All Scripture Is Inspired (si) Study 3",
   "title_en": "Study Number 3—Measuring Events in the Stream of Time",
   "title_ta": "ஆராய்ச்சி எண் 3—கால ஓட்டத்தில் நிகழ்ச்சிகளை அளவிடுதல்",
   "url_en": "https://wol.jw.org/en/wol/d/r1/lp-e/1101990130",
   "url_ta": "https://wol.jw.org/ta/wol/d/r122/lp-tl/1101990130",
   "finder_url": "https://www.jw.org/finder?docid=1101990130&wtlocale=E"
  },
  {
   "docid": "1200000970",
   "publication": "Insight (it-1) \"Chronology\" — chart \"Outstanding Dates During the Period of the Kings of Judah and of Israel\"",
   "title_en": "Chronology",
   "title_ta": null,
   "url_en": "https://wol.jw.org/en/wol/d/r1/lp-e/1200000970",
   "url_ta": null,
   "finder_url": "https://www.jw.org/finder?docid=1200000970&wtlocale=E"
  },
  {
   "docid": "1001061215",
   "publication": "NWT App. A6-B",
   "title_en": "A6-B Chart: Prophets and Kings of Judah and of Israel (Part 2)",
   "title_ta": "A6-B பட்டியல்: யூதாவிலும் இஸ்ரவேலிலும் இருந்த தீர்க்கதரிசிகள் மற்றும் ராஜாக்கள் (பகுதி 2)",
   "url_en": "https://wol.jw.org/en/wol/d/r1/lp-e/1001061215",
   "url_ta": "https://wol.jw.org/ta/wol/d/r122/lp-tl/1001061215",
   "finder_url": "https://www.jw.org/finder?docid=1001061215&wtlocale=E"
  }
 ],
 "images": [],
 "groups": [],
 "members": [
  {
   "event_id": "d1-0032",
   "order": 1,
   "role": "ruler",
   "group": null,
   "label_en": "Reign of Rehoboam (Judah)",
   "label_ta": null,
   "pairs_with": [],
   "scriptures": [],
   "source_docid": null,
   "note": null
  },
  {
   "event_id": "d1-0033",
   "order": 2,
   "role": "ruler",
   "group": null,
   "label_en": "Reign of Abijah (Judah)",
   "label_ta": null,
   "pairs_with": [],
   "scriptures": [],
   "source_docid": null,
   "note": null
  },
  {
   "event_id": "d1-0034",
   "order": 3,
   "role": "ruler",
   "group": null,
   "label_en": "Reign of Asa (Judah)",
   "label_ta": null,
   "pairs_with": [],
   "scriptures": [],
   "source_docid": null,
   "note": null
  },
  {
   "event_id": "d1-0035",
   "order": 4,
   "role": "ruler",
   "group": null,
   "label_en": "Reign of Jehoshaphat (Judah)",
   "label_ta": null,
   "pairs_with": [],
   "scriptures": [],
   "source_docid": null,
   "note": null
  },
  {
   "event_id": "d1-0036",
   "order": 5,
   "role": "ruler",
   "group": null,
   "label_en": "Reign of Jehoram (Judah)",
   "label_ta": null,
   "pairs_with": [],
   "scriptures": [],
   "source_docid": null,
   "note": null
  },
  {
   "event_id": "d1-0037",
   "order": 6,
   "role": "ruler",
   "group": null,
   "label_en": "Reign of Ahaziah (Judah)",
   "label_ta": null,
   "pairs_with": [],
   "scriptures": [],
   "source_docid": null,
   "note": null
  },
  {
   "event_id": "d1-0038",
   "order": 7,
   "role": "ruler",
   "group": null,
   "label_en": "Reign of Athaliah (Judah)",
   "label_ta": null,
   "pairs_with": [],
   "scriptures": [],
   "source_docid": null,
   "note": null
  },
  {
   "event_id": "d1-0039",
   "order": 8,
   "role": "ruler",
   "group": null,
   "label_en": "Reign of Jehoash (Judah)",
   "label_ta": null,
   "pairs_with": [],
   "scriptures": [],
   "source_docid": null,
   "note": null
  },
  {
   "event_id": "d1-0040",
   "order": 9,
   "role": "ruler",
   "group": null,
   "label_en": "Reign of Amaziah (Judah)",
   "label_ta": null,
   "pairs_with": [],
   "scriptures": [],
   "source_docid": null,
   "note": null
  },
  {
   "event_id": "d1-0041",
   "order": 10,
   "role": "ruler",
   "group": null,
   "label_en": "Reign of Uzziah (Azariah) (Judah)",
   "label_ta": null,
   "pairs_with": [],
   "scriptures": [],
   "source_docid": null,
   "note": null
  },
  {
   "event_id": "d1-0042",
   "order": 11,
   "role": "ruler",
   "group": null,
   "label_en": "Reign of Jotham (Judah)",
   "label_ta": null,
   "pairs_with": [],
   "scriptures": [],
   "source_docid": null,
   "note": null
  },
  {
   "event_id": "d1-0043",
   "order": 12,
   "role": "ruler",
   "group": null,
   "label_en": "Reign of Ahaz (Judah)",
   "label_ta": null,
   "pairs_with": [],
   "scriptures": [],
   "source_docid": null,
   "note": null
  },
  {
   "event_id": "d1-0044",
   "order": 13,
   "role": "ruler",
   "group": null,
   "label_en": "Reign of Hezekiah (Judah)",
   "label_ta": null,
   "pairs_with": [],
   "scriptures": [],
   "source_docid": null,
   "note": null
  },
  {
   "event_id": "d1-0045",
   "order": 14,
   "role": "ruler",
   "group": null,
   "label_en": "Reign of Manasseh (Judah)",
   "label_ta": null,
   "pairs_with": [],
   "scriptures": [],
   "source_docid": null,
   "note": null
  },
  {
   "event_id": "d1-0046",
   "order": 15,
   "role": "ruler",
   "group": null,
   "label_en": "Reign of Amon (Judah)",
   "label_ta": null,
   "pairs_with": [],
   "scriptures": [],
   "source_docid": null,
   "note": null
  },
  {
   "event_id": "d1-0047",
   "order": 16,
   "role": "ruler",
   "group": null,
   "label_en": "Reign of Josiah (Judah)",
   "label_ta": null,
   "pairs_with": [],
   "scriptures": [],
   "source_docid": null,
   "note": null
  },
  {
   "event_id": "d1-0048",
   "order": 17,
   "role": "ruler",
   "group": null,
   "label_en": "Reign of Jehoahaz (Judah)",
   "label_ta": null,
   "pairs_with": [],
   "scriptures": [],
   "source_docid": null,
   "note": null
  },
  {
   "event_id": "d1-0049",
   "order": 18,
   "role": "ruler",
   "group": null,
   "label_en": "Reign of Jehoiakim (Judah)",
   "label_ta": null,
   "pairs_with": [],
   "scriptures": [],
   "source_docid": null,
   "note": null
  },
  {
   "event_id": "d1-0050",
   "order": 19,
   "role": "ruler",
   "group": null,
   "label_en": "Reign of Jehoiachin (Judah)",
   "label_ta": null,
   "pairs_with": [],
   "scriptures": [],
   "source_docid": null,
   "note": null
  },
  {
   "event_id": "d1-0051",
   "order": 20,
   "role": "ruler",
   "group": null,
   "label_en": "Reign of Zedekiah (Judah)",
   "label_ta": null,
   "pairs_with": [],
   "scriptures": [],
   "source_docid": null,
   "note": null
  }
 ],
 "notes": "Generated by scripts/build_series.py from existing records; sources are those of the member records."
}