{
 "id": "rulers-of-persia",
 "title_en": "Rulers of Persia in the Bible record",
 "title_ta": null,
 "kind": "succession",
 "description_en": "Persian kings who appear in the Bible record, from Cyrus the Great to Artaxerxes I.",
 "description_ta": null,
 "highlight": false,
 "auto": true,
 "parent_series": null,
 "sources": [
  {
   "docid": "1200003447",
   "publication": "Insight on the Scriptures, Vol. 2 (it-2 “Persia, Persians”)",
   "title_en": "Persia, Persians",
   "title_ta": null,
   "url_en": "https://wol.jw.org/en/wol/d/r1/lp-e/1200003447",
   "url_ta": null,
   "finder_url": "https://www.jw.org/finder?docid=1200003447&wtlocale=E"
  },
  {
   "docid": "1200001102",
   "publication": "Insight on the Scriptures, Vol. 1 (it-1 “Cyrus”)",
   "title_en": "Cyrus",
   "title_ta": null,
   "url_en": "https://wol.jw.org/en/wol/d/r1/lp-e/1200001102",
   "url_ta": null,
   "finder_url": "https://www.jw.org/finder?docid=1200001102&wtlocale=E"
  },
  {
   "docid": "1200000970",
   "publication": "Insight on the Scriptures, Vol. 1 (it-1 “Chronology”)",
   "title_en": "Chronology",
   "title_ta": null,
   "url_en": "https://wol.jw.org/en/wol/d/r1/lp-e/1200000970",
   "url_ta": null,
   "finder_url": "https://www.jw.org/finder?docid=1200000970&wtlocale=E"
  }
 ],
 "images": [],
 "groups": [],
 "members": [
  {
   "event_id": "b12-0026",
   "order": 1,
   "role": "ruler",
   "group": null,
   "label_en": "Reign of Cyrus the Great",
   "label_ta": null,
   "pairs_with": [],
   "scriptures": [],
   "source_docid": null,
   "note": null
  },
  {
   "event_id": "b12-0030",
   "order": 2,
   "role": "ruler",
   "group": null,
   "label_en": "Reign of Darius I (the Great) of Persia",
   "label_ta": null,
   "pairs_with": [],
   "scriptures": [],
   "source_docid": null,
   "note": null
  },
  {
   "event_id": "b12-0031",
   "order": 3,
   "role": "ruler",
   "group": null,
   "label_en": "Reign of Xerxes I (Ahasuerus) as sole king",
   "label_ta": null,
   "pairs_with": [],
   "scriptures": [],
   "source_docid": null,
   "note": null
  },
  {
   "event_id": "b12-0032",
   "order": 4,
   "role": "ruler",
   "group": null,
   "label_en": "Reign of Artaxerxes I (Longimanus)",
   "label_ta": null,
   "pairs_with": [],
   "scriptures": [],
   "source_docid": null,
   "note": null
  }
 ],
 "notes": "Generated by scripts/build_series.py from existing records; sources are those of the member records."
}