{
 "id": "kingdom-of-david-and-solomon",
 "title_en": "Kingdom of David and Solomon",
 "title_ta": "தாவீது மற்றும் சாலொமோனின் ராஜ்யம்",
 "kind": "chart_reproduction",
 "description_en": "NWT Appendix B7 maps the kingdom of David and Solomon, extending to Tiphsah on the Euphrates. Its timeline marks David’s reign (1077-1038 B.C.E.), the Davidic covenant (c. 1070 B.C.E.) and Solomon’s reign (1037-998 B.C.E.).",
 "description_ta": null,
 "highlight": false,
 "auto": false,
 "parent_series": null,
 "sources": [
  {
   "docid": "1001070227",
   "publication": "NWT Study Edition (nwtsty) App. B7",
   "title_en": "B7 Kingdom of David and Solomon",
   "title_ta": "B7 தாவீது மற்றும் சாலொமோனின் ராஜ்யம்",
   "url_en": "https://wol.jw.org/en/wol/d/r1/lp-e/1001070227",
   "url_ta": "https://wol.jw.org/ta/wol/d/r122/lp-tl/1001070227",
   "finder_url": "https://www.jw.org/finder?docid=1001070227&wtlocale=E",
   "par": null,
   "quote_en": null,
   "supports": null
  },
  {
   "docid": "1001061227",
   "publication": "New World Translation (nwt) App. B7",
   "title_en": "B7 Kingdom of David and Solomon",
   "title_ta": "B7 தாவீது மற்றும் சாலொமோனின் ராஜ்யம்",
   "url_en": "https://wol.jw.org/en/wol/d/r1/lp-e/1001061227",
   "url_ta": "https://wol.jw.org/ta/wol/d/r122/lp-tl/1001061227",
   "finder_url": "https://www.jw.org/finder?docid=1001061227&wtlocale=E",
   "par": null,
   "quote_en": null,
   "supports": null
  }
 ],
 "images": [
  {
   "url": "https://wol.jw.org/en/wol/mp/r1/lp-e/nwtsty/2026/98",
   "caption_en": "B7 Kingdom of David and Solomon — printed-edition image",
   "caption_ta": "B7 தாவீது மற்றும் சாலொமோனின் ராஜ்யம்",
   "source_docid": "1001070227",
   "kind": "map"
  },
  {
   "url": "https://wol.jw.org/ta/wol/mp/r122/lp-tl/nwtsty/2018/98",
   "caption_en": "Tamil edition: B7 Kingdom of David and Solomon — printed-edition image",
   "caption_ta": "B7 தாவீது மற்றும் சாலொமோனின் ராஜ்யம்",
   "source_docid": "1001070227",
   "kind": "map"
  },
  {
   "url": "https://wol.jw.org/en/wol/mp/r1/lp-e/nwtsty/2026/97",
   "caption_en": "B7 Kingdom of David and Solomon — printed-edition image (SVG)",
   "caption_ta": "B7 தாவீது மற்றும் சாலொமோனின் ராஜ்யம்",
   "source_docid": "1001070227",
   "kind": "map"
  },
  {
   "url": "https://wol.jw.org/ta/wol/mp/r122/lp-tl/nwtsty/2018/97",
   "caption_en": "Tamil edition: B7 Kingdom of David and Solomon — printed-edition image (SVG)",
   "caption_ta": "B7 தாவீது மற்றும் சாலொமோனின் ராஜ்யம்",
   "source_docid": "1001070227",
   "kind": "map"
  },
  {
   "url": "https://wol.jw.org/en/wol/mp/r1/lp-e/nwt/2013/111",
   "caption_en": "B7 Kingdom of David and Solomon — printed-edition image",
   "caption_ta": "B7 தாவீது மற்றும் சாலொமோனின் ராஜ்யம்",
   "source_docid": "1001061227",
   "kind": "map"
  },
  {
   "url": "https://wol.jw.org/ta/wol/mp/r122/lp-tl/nwt/2016/111",
   "caption_en": "Tamil edition: B7 Kingdom of David and Solomon — printed-edition image",
   "caption_ta": "B7 தாவீது மற்றும் சாலொமோனின் ராஜ்யம்",
   "source_docid": "1001061227",
   "kind": "map"
  }
 ],
 "groups": [
  {
   "id": "map-legend",
   "order": 1,
   "label_en": "Shown on the Map",
   "label_ta": "வரைபடத்தில் காட்டப்பட்டுள்ளது",
   "span_id": null,
   "attributes": {
    "areas": "David’s Kingdom; Solomon’s Kingdom",
    "imports_exports": "To Syria, Hittites: Horses, Chariots; From Tarshish: Gold, Silver, Ivory, Apes, Peacocks; From Tyre: Cedars, Junipers, Gold; To Tyre: Barley, Wheat, Wine, Olive Oil; From Egypt: Horses, Chariots; From Ophir: Gold, Gems, Timber; From Arabia: Gold, Silver"
   },
   "note": "Map legend (no members)."
  }
 ],
 "members": [
  {
   "event_id": "b12-0012",
   "order": 1,
   "role": "item",
   "group": null,
   "label_en": "David’s reign",
   "label_ta": "தாவீதின் ஆட்சி",
   "pairs_with": [],
   "scriptures": [],
   "source_docid": "1001070227",
   "note": "Shown on the timeline of the map."
  },
  {
   "event_id": "b3-0006",
   "order": 2,
   "role": "context",
   "group": null,
   "label_en": null,
   "label_ta": null,
   "pairs_with": [],
   "scriptures": [],
   "source_docid": "1001070227",
   "note": "David becomes king at Hebron (on the map)."
  },
  {
   "event_id": "b3-0007",
   "order": 3,
   "role": "context",
   "group": null,
   "label_en": null,
   "label_ta": null,
   "pairs_with": [],
   "scriptures": [],
   "source_docid": "1001070227",
   "note": "Jerusalem becomes the capital."
  },
  {
   "event_id": "b3-0009",
   "order": 4,
   "role": "item",
   "group": null,
   "label_en": "Davidic covenant",
   "label_ta": "தாவீதுடன் ஒப்பந்தம் செய்யப்படுகிறது",
   "pairs_with": [],
   "scriptures": [],
   "source_docid": "1001070227",
   "note": "Shown on the timeline of the map. B7 prints ‘c. 1070 B.C.E.’; the record (from ‘All Scripture’ Study 3) has ‘a. 1070 B.C.E.’."
  },
  {
   "event_id": "b12-0013",
   "order": 5,
   "role": "item",
   "group": null,
   "label_en": "Solomon’s reign",
   "label_ta": "சாலொமோனின் ஆட்சி",
   "pairs_with": [],
   "scriptures": [],
   "source_docid": "1001070227",
   "note": "Shown on the timeline of the map."
  }
 ],
 "notes": "‘Item’ = the map’s timeline entries. Difference: B7 dates the Davidic covenant c. 1070 B.C.E.; record b3-0009 has a. 1070 B.C.E."
}