{
 "id": "united-kingdom",
 "title_en": "Kings of the united kingdom of Israel",
 "title_ta": null,
 "kind": "succession",
 "description_en": "Saul, David and Solomon ruled all twelve tribes, 1117–997 B.C.E.",
 "description_ta": null,
 "highlight": false,
 "auto": true,
 "parent_series": null,
 "sources": [
  {
   "docid": "1200000970",
   "publication": "Insight on the Scriptures, Vol. 1 (it-1 “Chronology”)",
   "title_en": "Chronology",
   "title_ta": null,
   "url_en": "https://wol.jw.org/en/wol/d/r1/lp-e/1200000970",
   "url_ta": null,
   "finder_url": "https://www.jw.org/finder?docid=1200000970&wtlocale=E"
  },
  {
   "docid": "1001061227",
   "publication": "New World Translation (2013) (nwt pp. 1776-1777)",
   "title_en": "B7 Kingdom of David and Solomon",
   "title_ta": "B7 தாவீது மற்றும் சாலொமோனின் ராஜ்யம்",
   "url_en": "https://wol.jw.org/en/wol/d/r1/lp-e/1001061227",
   "url_ta": "https://wol.jw.org/ta/wol/d/r122/lp-tl/1001061227",
   "finder_url": "https://www.jw.org/finder?docid=1001061227&wtlocale=E"
  },
  {
   "docid": "1200004178",
   "publication": "Insight on the Scriptures, Vol. 2 (it-2 “Solomon”)",
   "title_en": "Solomon",
   "title_ta": null,
   "url_en": "https://wol.jw.org/en/wol/d/r1/lp-e/1200004178",
   "url_ta": null,
   "finder_url": "https://www.jw.org/finder?docid=1200004178&wtlocale=E"
  }
 ],
 "images": [],
 "groups": [],
 "members": [
  {
   "event_id": "b12-0009",
   "order": 1,
   "role": "ruler",
   "group": null,
   "label_en": "Reign of Saul over Israel",
   "label_ta": null,
   "pairs_with": [],
   "scriptures": [],
   "source_docid": null,
   "note": null
  },
  {
   "event_id": "b12-0012",
   "order": 2,
   "role": "ruler",
   "group": null,
   "label_en": "Reign of David",
   "label_ta": "தாவீதின் ஆட்சி",
   "pairs_with": [],
   "scriptures": [],
   "source_docid": null,
   "note": null
  },
  {
   "event_id": "b12-0013",
   "order": 3,
   "role": "ruler",
   "group": null,
   "label_en": "Reign of Solomon",
   "label_ta": "சாலொமோனின் ஆட்சி",
   "pairs_with": [],
   "scriptures": [],
   "source_docid": null,
   "note": null
  }
 ],
 "notes": "Generated by scripts/build_series.py from existing records; sources are those of the member records."
}