{
 "id": "conquest-of-canaan",
 "title_en": "Conquest of the Promised Land",
 "title_ta": "வாக்குக் கொடுக்கப்பட்ட தேசத்தைக் கைப்பற்றுதல்",
 "kind": "chart_reproduction",
 "description_en": "NWT Appendix B4 shows the campaign routes of Israel’s conquest of the Promised Land, from Shittim across the Jordan to Jericho and Ai, south to Lachish and Debir and north to the waters of Merom and Hazor, and east of the Jordan against Sihon and Og. Its timeline marks Israel entering Canaan (1473 B.C.E.) and the completion of the major conquest (1467 B.C.E.).",
 "description_ta": null,
 "highlight": false,
 "auto": false,
 "parent_series": null,
 "sources": [
  {
   "docid": "1001070224",
   "publication": "NWT Study Edition (nwtsty) App. B4",
   "title_en": "B4 Conquest of the Promised Land",
   "title_ta": "B4 வாக்குக் கொடுக்கப்பட்ட தேசத்தைக் கைப்பற்றுதல்",
   "url_en": "https://wol.jw.org/en/wol/d/r1/lp-e/1001070224",
   "url_ta": "https://wol.jw.org/ta/wol/d/r122/lp-tl/1001070224",
   "finder_url": "https://www.jw.org/finder?docid=1001070224&wtlocale=E",
   "par": null,
   "quote_en": null,
   "supports": null
  },
  {
   "docid": "1001061224",
   "publication": "New World Translation (nwt) App. B4",
   "title_en": "B4 Conquest of the Promised Land",
   "title_ta": "B4 வாக்குக் கொடுக்கப்பட்ட தேசத்தைக் கைப்பற்றுதல்",
   "url_en": "https://wol.jw.org/en/wol/d/r1/lp-e/1001061224",
   "url_ta": "https://wol.jw.org/ta/wol/d/r122/lp-tl/1001061224",
   "finder_url": "https://www.jw.org/finder?docid=1001061224&wtlocale=E",
   "par": null,
   "quote_en": null,
   "supports": null
  }
 ],
 "images": [
  {
   "url": "https://wol.jw.org/en/wol/mp/r1/lp-e/nwtsty/2026/92",
   "caption_en": "B4 Conquest of the Promised Land — printed-edition image",
   "caption_ta": "B4 வாக்குக் கொடுக்கப்பட்ட தேசத்தைக் கைப்பற்றுதல்",
   "source_docid": "1001070224",
   "kind": "map"
  },
  {
   "url": "https://wol.jw.org/ta/wol/mp/r122/lp-tl/nwtsty/2018/92",
   "caption_en": "Tamil edition: B4 Conquest of the Promised Land — printed-edition image",
   "caption_ta": "B4 வாக்குக் கொடுக்கப்பட்ட தேசத்தைக் கைப்பற்றுதல்",
   "source_docid": "1001070224",
   "kind": "map"
  },
  {
   "url": "https://wol.jw.org/en/wol/mp/r1/lp-e/nwtsty/2026/91",
   "caption_en": "B4 Conquest of the Promised Land — printed-edition image (SVG)",
   "caption_ta": "B4 வாக்குக் கொடுக்கப்பட்ட தேசத்தைக் கைப்பற்றுதல்",
   "source_docid": "1001070224",
   "kind": "map"
  },
  {
   "url": "https://wol.jw.org/ta/wol/mp/r122/lp-tl/nwtsty/2018/91",
   "caption_en": "Tamil edition: B4 Conquest of the Promised Land — printed-edition image (SVG)",
   "caption_ta": "B4 வாக்குக் கொடுக்கப்பட்ட தேசத்தைக் கைப்பற்றுதல்",
   "source_docid": "1001070224",
   "kind": "map"
  },
  {
   "url": "https://wol.jw.org/en/wol/mp/r1/lp-e/nwt/2013/105",
   "caption_en": "B4 Conquest of the Promised Land — printed-edition image",
   "caption_ta": "B4 வாக்குக் கொடுக்கப்பட்ட தேசத்தைக் கைப்பற்றுதல்",
   "source_docid": "1001061224",
   "kind": "map"
  },
  {
   "url": "https://wol.jw.org/ta/wol/mp/r122/lp-tl/nwt/2016/105",
   "caption_en": "Tamil edition: B4 Conquest of the Promised Land — printed-edition image",
   "caption_ta": "B4 வாக்குக் கொடுக்கப்பட்ட தேசத்தைக் கைப்பற்றுதல்",
   "source_docid": "1001061224",
   "kind": "map"
  }
 ],
 "groups": [],
 "members": [
  {
   "event_id": "b2-0035",
   "order": 1,
   "role": "context",
   "group": null,
   "label_en": null,
   "label_ta": null,
   "pairs_with": [],
   "scriptures": [],
   "source_docid": "1001070224",
   "note": "Amorites (Sihon) and Amorites (Og) east of the Jordan are on the map."
  },
  {
   "event_id": "b2-0045",
   "order": 2,
   "role": "item",
   "group": null,
   "label_en": "Israel enters Canaan",
   "label_ta": "இஸ்ரவேலர்கள் கானானில் நுழைகிறார்கள்",
   "pairs_with": [],
   "scriptures": [],
   "source_docid": "1001070224",
   "note": "Shown on the timeline of the map."
  },
  {
   "event_id": "b12-0008",
   "order": 3,
   "role": "context",
   "group": null,
   "label_en": null,
   "label_ta": null,
   "pairs_with": [],
   "scriptures": [],
   "source_docid": "1001070224",
   "note": "The conquest period the map’s campaign routes illustrate."
  },
  {
   "event_id": "b2-0046",
   "order": 4,
   "role": "context",
   "group": null,
   "label_en": null,
   "label_ta": null,
   "pairs_with": [],
   "scriptures": [],
   "source_docid": "1001070224",
   "note": "Gilgal is on the campaign route."
  },
  {
   "event_id": "b2-0049",
   "order": 5,
   "role": "context",
   "group": null,
   "label_en": null,
   "label_ta": null,
   "pairs_with": [],
   "scriptures": [],
   "source_docid": "1001070224",
   "note": "Jericho is on the campaign route."
  },
  {
   "event_id": "b2-0050",
   "order": 6,
   "role": "context",
   "group": null,
   "label_en": null,
   "label_ta": null,
   "pairs_with": [],
   "scriptures": [],
   "source_docid": "1001070224",
   "note": "Ai is on the campaign route."
  },
  {
   "event_id": "b2-0051",
   "order": 7,
   "role": "item",
   "group": null,
   "label_en": "Major conquest of the land completed",
   "label_ta": "பெரும்பாலான பகுதிகள் கைப்பற்றப்படுகின்றன",
   "pairs_with": [],
   "scriptures": [],
   "source_docid": "1001070224",
   "note": "Shown on the timeline of the map."
  }
 ],
 "notes": "‘Item’ = the map’s timeline entries; ‘context’ = dated records at places on the drawn campaign routes."
}