{
 "id": "governing-body",
 "title_en": "Members of the Governing Body",
 "title_ta": null,
 "kind": "succession",
 "description_en": "Tenures of Governing Body members that jw.org dates.",
 "description_ta": null,
 "highlight": false,
 "auto": true,
 "parent_series": null,
 "sources": [
  {
   "docid": "2025605",
   "publication": "The Watchtower (w25 October pp. 30-31)",
   "title_en": "Two New Members of the Governing Body",
   "title_ta": "ஆளும் குழுவின் இரண்டு புதிய அங்கத்தினர்கள்",
   "url_en": "https://wol.jw.org/en/wol/d/r1/lp-e/2025605",
   "url_ta": "https://wol.jw.org/ta/wol/d/r122/lp-tl/2025605",
   "finder_url": "https://www.jw.org/finder?docid=2025605&wtlocale=E"
  },
  {
   "docid": "2000007",
   "publication": "The Watchtower (w00 1/1 p. 29)",
   "title_en": "New Members of the Governing Body",
   "title_ta": "ஆளும் குழுவின் புதிய அங்கத்தினர்கள்",
   "url_en": "https://wol.jw.org/en/wol/d/r1/lp-e/2000007",
   "url_ta": "https://wol.jw.org/ta/wol/d/r122/lp-tl/2000007",
   "finder_url": "https://www.jw.org/finder?docid=2000007&wtlocale=E"
  },
  {
   "docid": "2024287",
   "publication": "The Watchtower (w24 February pp. 28-29)",
   "title_en": "Two New Members of the Governing Body",
   "title_ta": "ஆளும் குழுவின் இரண்டு புதிய அங்கத்தினர்கள்",
   "url_en": "https://wol.jw.org/en/wol/d/r1/lp-e/2024287",
   "url_ta": "https://wol.jw.org/ta/wol/d/r122/lp-tl/2024287",
   "finder_url": "https://www.jw.org/finder?docid=2024287&wtlocale=E"
  }
 ],
 "images": [],
 "groups": [],
 "members": [
  {
   "event_id": "b12-0095",
   "order": 1,
   "role": "ruler",
   "group": null,
   "label_en": "Theodore Jaracz serves on the Governing Body",
   "label_ta": null,
   "pairs_with": [],
   "scriptures": [],
   "source_docid": null,
   "note": null
  },
  {
   "event_id": "b12-0096",
   "order": 2,
   "role": "ruler",
   "group": null,
   "label_en": "Daniel Sydlik serves on the Governing Body",
   "label_ta": null,
   "pairs_with": [],
   "scriptures": [],
   "source_docid": null,
   "note": null
  },
  {
   "event_id": "b12-0098",
   "order": 3,
   "role": "ruler",
   "group": null,
   "label_en": "Martin Poetzinger serves on the Governing Body",
   "label_ta": null,
   "pairs_with": [],
   "scriptures": [],
   "source_docid": null,
   "note": null
  },
  {
   "event_id": "b12-0101",
   "order": 4,
   "role": "ruler",
   "group": null,
   "label_en": "Gerrit Lösch serves on the Governing Body",
   "label_ta": null,
   "pairs_with": [],
   "scriptures": [],
   "source_docid": null,
   "note": null
  },
  {
   "event_id": "b12-0102",
   "order": 5,
   "role": "ruler",
   "group": null,
   "label_en": "Guy H. Pierce serves on the Governing Body",
   "label_ta": null,
   "pairs_with": [],
   "scriptures": [],
   "source_docid": null,
   "note": null
  },
  {
   "event_id": "b12-0103",
   "order": 6,
   "role": "ruler",
   "group": null,
   "label_en": "Samuel F. Herd serves on the Governing Body",
   "label_ta": null,
   "pairs_with": [],
   "scriptures": [],
   "source_docid": null,
   "note": null
  },
  {
   "event_id": "b12-0104",
   "order": 7,
   "role": "ruler",
   "group": null,
   "label_en": "M. Stephen Lett serves on the Governing Body",
   "label_ta": null,
   "pairs_with": [],
   "scriptures": [],
   "source_docid": null,
   "note": null
  },
  {
   "event_id": "b12-0105",
   "order": 8,
   "role": "ruler",
   "group": null,
   "label_en": "David H. Splane serves on the Governing Body",
   "label_ta": null,
   "pairs_with": [],
   "scriptures": [],
   "source_docid": null,
   "note": null
  },
  {
   "event_id": "b12-0106",
   "order": 9,
   "role": "ruler",
   "group": null,
   "label_en": "Anthony Morris III serves on the Governing Body",
   "label_ta": null,
   "pairs_with": [],
   "scriptures": [],
   "source_docid": null,
   "note": null
  },
  {
   "event_id": "b12-0107",
   "order": 10,
   "role": "ruler",
   "group": null,
   "label_en": "Geoffrey W. Jackson serves on the Governing Body",
   "label_ta": null,
   "pairs_with": [],
   "scriptures": [],
   "source_docid": null,
   "note": null
  },
  {
   "event_id": "b12-0108",
   "order": 11,
   "role": "ruler",
   "group": null,
   "label_en": "Mark Sanderson serves on the Governing Body",
   "label_ta": null,
   "pairs_with": [],
   "scriptures": [],
   "source_docid": null,
   "note": null
  },
  {
   "event_id": "b12-0112",
   "order": 12,
   "role": "ruler",
   "group": null,
   "label_en": "Kenneth Cook, Jr. serves on the Governing Body",
   "label_ta": null,
   "pairs_with": [],
   "scriptures": [],
   "source_docid": null,
   "note": null
  },
  {
   "event_id": "b12-0114",
   "order": 13,
   "role": "ruler",
   "group": null,
   "label_en": "Gage Fleegle serves on the Governing Body",
   "label_ta": null,
   "pairs_with": [],
   "scriptures": [],
   "source_docid": null,
   "note": null
  },
  {
   "event_id": "b12-0115",
   "order": 14,
   "role": "ruler",
   "group": null,
   "label_en": "Jeffrey Winder serves on the Governing Body",
   "label_ta": null,
   "pairs_with": [],
   "scriptures": [],
   "source_docid": null,
   "note": null
  },
  {
   "event_id": "b12-0116",
   "order": 15,
   "role": "ruler",
   "group": null,
   "label_en": "Jody Jedele serves on the Governing Body",
   "label_ta": null,
   "pairs_with": [],
   "scriptures": [],
   "source_docid": null,
   "note": null
  },
  {
   "event_id": "b12-0117",
   "order": 16,
   "role": "ruler",
   "group": null,
   "label_en": "Jacob Rumph serves on the Governing Body",
   "label_ta": null,
   "pairs_with": [],
   "scriptures": [],
   "source_docid": null,
   "note": null
  }
 ],
 "notes": "Generated by scripts/build_series.py from existing records; sources are those of the member records."
}