{
 "id": "pre-flood-patriarchs",
 "title_en": "Lives of the patriarchs before the Flood",
 "title_ta": null,
 "kind": "lineage",
 "description_en": "The overlapping long lives from Adam to Noah, from Genesis 5 as dated in 'All Scripture Is Inspired' Study 3.",
 "description_ta": null,
 "highlight": false,
 "auto": true,
 "parent_series": null,
 "sources": [
  {
   "docid": "1101990130",
   "publication": "All Scripture Is Inspired (si)",
   "title_en": "Study Number 3—Measuring Events in the Stream of Time",
   "title_ta": "ஆராய்ச்சி எண் 3—கால ஓட்டத்தில் நிகழ்ச்சிகளை அளவிடுதல்",
   "url_en": "https://wol.jw.org/en/wol/d/r1/lp-e/1101990130",
   "url_ta": "https://wol.jw.org/ta/wol/d/r122/lp-tl/1101990130",
   "finder_url": "https://www.jw.org/finder?docid=1101990130&wtlocale=E"
  },
  {
   "docid": "1200000089",
   "publication": "Insight on the Scriptures (it-1)",
   "title_en": "Adam",
   "title_ta": null,
   "url_en": "https://wol.jw.org/en/wol/d/r1/lp-e/1200000089",
   "url_ta": null,
   "finder_url": "https://www.jw.org/finder?docid=1200000089&wtlocale=E"
  },
  {
   "docid": "1200000970",
   "publication": "Insight on the Scriptures (it-1)",
   "title_en": "Chronology",
   "title_ta": null,
   "url_en": "https://wol.jw.org/en/wol/d/r1/lp-e/1200000970",
   "url_ta": null,
   "finder_url": "https://www.jw.org/finder?docid=1200000970&wtlocale=E"
  }
 ],
 "images": [],
 "groups": [],
 "members": [
  {
   "event_id": "d1-0001",
   "order": 1,
   "role": "item",
   "group": null,
   "label_en": "Life of Adam",
   "label_ta": null,
   "pairs_with": [],
   "scriptures": [],
   "source_docid": null,
   "note": null
  },
  {
   "event_id": "d1-0002",
   "order": 2,
   "role": "item",
   "group": null,
   "label_en": "Life of Seth",
   "label_ta": null,
   "pairs_with": [],
   "scriptures": [],
   "source_docid": null,
   "note": null
  },
  {
   "event_id": "d1-0003",
   "order": 3,
   "role": "item",
   "group": null,
   "label_en": "Life of Jared",
   "label_ta": null,
   "pairs_with": [],
   "scriptures": [],
   "source_docid": null,
   "note": null
  },
  {
   "event_id": "d1-0004",
   "order": 4,
   "role": "item",
   "group": null,
   "label_en": "Life of Enoch (until God took him)",
   "label_ta": null,
   "pairs_with": [],
   "scriptures": [],
   "source_docid": null,
   "note": null
  },
  {
   "event_id": "d1-0005",
   "order": 5,
   "role": "item",
   "group": null,
   "label_en": "Life of Methuselah",
   "label_ta": null,
   "pairs_with": [],
   "scriptures": [],
   "source_docid": null,
   "note": null
  },
  {
   "event_id": "d1-0006",
   "order": 6,
   "role": "item",
   "group": null,
   "label_en": "Life of Noah",
   "label_ta": null,
   "pairs_with": [],
   "scriptures": [],
   "source_docid": null,
   "note": null
  }
 ],
 "notes": "Generated by scripts/build_series.py from existing records; sources are those of the member records."
}