{
 "id": "kings-of-israel",
 "title_en": "Kings of Israel",
 "title_ta": null,
 "kind": "succession",
 "description_en": "The kings of the northern ten-tribe kingdom of Israel, 997–740 B.C.E., in the order of NWT Appendix A6.",
 "description_ta": null,
 "highlight": false,
 "auto": true,
 "parent_series": "prophets-and-kings-a6",
 "sources": [
  {
   "docid": "1101990130",
   "publication": "All Scripture Is Inspired (si) Study 3",
   "title_en": "Study Number 3—Measuring Events in the Stream of Time",
   "title_ta": "ஆராய்ச்சி எண் 3—கால ஓட்டத்தில் நிகழ்ச்சிகளை அளவிடுதல்",
   "url_en": "https://wol.jw.org/en/wol/d/r1/lp-e/1101990130",
   "url_ta": "https://wol.jw.org/ta/wol/d/r122/lp-tl/1101990130",
   "finder_url": "https://www.jw.org/finder?docid=1101990130&wtlocale=E"
  },
  {
   "docid": "1200000970",
   "publication": "Insight (it-1) \"Chronology\" — chart \"Outstanding Dates During the Period of the Kings of Judah and of Israel\"",
   "title_en": "Chronology",
   "title_ta": null,
   "url_en": "https://wol.jw.org/en/wol/d/r1/lp-e/1200000970",
   "url_ta": null,
   "finder_url": "https://www.jw.org/finder?docid=1200000970&wtlocale=E"
  },
  {
   "docid": "1001070206",
   "publication": "NWT Study Edition App. A6-A",
   "title_en": "A6-A Chart: Prophets and Kings of Judah and of Israel (Part 1)",
   "title_ta": "A6-A பட்டியல்: யூதாவிலும் இஸ்ரவேலிலும் இருந்த தீர்க்கதரிசிகள் மற்றும் ராஜாக்கள் (பகுதி 1)",
   "url_en": "https://wol.jw.org/en/wol/d/r1/lp-e/1001070206",
   "url_ta": "https://wol.jw.org/ta/wol/d/r122/lp-tl/1001070206",
   "finder_url": "https://www.jw.org/finder?docid=1001070206&wtlocale=E"
  }
 ],
 "images": [],
 "groups": [],
 "members": [
  {
   "event_id": "d1-0052",
   "order": 1,
   "role": "ruler",
   "group": null,
   "label_en": "Reign of Jeroboam (Israel)",
   "label_ta": null,
   "pairs_with": [],
   "scriptures": [],
   "source_docid": null,
   "note": null
  },
  {
   "event_id": "d1-0053",
   "order": 2,
   "role": "ruler",
   "group": null,
   "label_en": "Reign of Nadab (Israel)",
   "label_ta": null,
   "pairs_with": [],
   "scriptures": [],
   "source_docid": null,
   "note": null
  },
  {
   "event_id": "d1-0054",
   "order": 3,
   "role": "ruler",
   "group": null,
   "label_en": "Reign of Baasha (Israel)",
   "label_ta": null,
   "pairs_with": [],
   "scriptures": [],
   "source_docid": null,
   "note": null
  },
  {
   "event_id": "d1-0055",
   "order": 4,
   "role": "ruler",
   "group": null,
   "label_en": "Reign of Elah (Israel)",
   "label_ta": null,
   "pairs_with": [],
   "scriptures": [],
   "source_docid": null,
   "note": null
  },
  {
   "event_id": "d1-0056",
   "order": 5,
   "role": "ruler",
   "group": null,
   "label_en": "Reign of Zimri (Israel)",
   "label_ta": null,
   "pairs_with": [],
   "scriptures": [],
   "source_docid": null,
   "note": null
  },
  {
   "event_id": "d1-0057",
   "order": 6,
   "role": "ruler",
   "group": null,
   "label_en": "Reign of Omri (Israel)",
   "label_ta": null,
   "pairs_with": [],
   "scriptures": [],
   "source_docid": null,
   "note": null
  },
  {
   "event_id": "d1-0058",
   "order": 7,
   "role": "ruler",
   "group": null,
   "label_en": "Reign of Ahab (Israel)",
   "label_ta": null,
   "pairs_with": [],
   "scriptures": [],
   "source_docid": null,
   "note": null
  },
  {
   "event_id": "d1-0059",
   "order": 8,
   "role": "ruler",
   "group": null,
   "label_en": "Reign of Ahaziah (Israel)",
   "label_ta": null,
   "pairs_with": [],
   "scriptures": [],
   "source_docid": null,
   "note": null
  },
  {
   "event_id": "d1-0060",
   "order": 9,
   "role": "ruler",
   "group": null,
   "label_en": "Reign of Jehoram (Israel)",
   "label_ta": null,
   "pairs_with": [],
   "scriptures": [],
   "source_docid": null,
   "note": null
  },
  {
   "event_id": "d1-0061",
   "order": 10,
   "role": "ruler",
   "group": null,
   "label_en": "Reign of Jehu (Israel)",
   "label_ta": null,
   "pairs_with": [],
   "scriptures": [],
   "source_docid": null,
   "note": null
  },
  {
   "event_id": "d1-0062",
   "order": 11,
   "role": "ruler",
   "group": null,
   "label_en": "Reign of Jehoahaz (Israel)",
   "label_ta": null,
   "pairs_with": [],
   "scriptures": [],
   "source_docid": null,
   "note": null
  },
  {
   "event_id": "d1-0063",
   "order": 12,
   "role": "ruler",
   "group": null,
   "label_en": "Reign of Jehoash (Israel)",
   "label_ta": null,
   "pairs_with": [],
   "scriptures": [],
   "source_docid": null,
   "note": null
  },
  {
   "event_id": "d1-0064",
   "order": 13,
   "role": "ruler",
   "group": null,
   "label_en": "Reign of Jeroboam II (Israel)",
   "label_ta": null,
   "pairs_with": [],
   "scriptures": [],
   "source_docid": null,
   "note": null
  },
  {
   "event_id": "d1-0065",
   "order": 14,
   "role": "ruler",
   "group": null,
   "label_en": "Reign of Zechariah (Israel)",
   "label_ta": null,
   "pairs_with": [],
   "scriptures": [],
   "source_docid": null,
   "note": null
  },
  {
   "event_id": "d1-0066",
   "order": 15,
   "role": "ruler",
   "group": null,
   "label_en": "Reign of Shallum (Israel)",
   "label_ta": null,
   "pairs_with": [],
   "scriptures": [],
   "source_docid": null,
   "note": null
  },
  {
   "event_id": "d1-0067",
   "order": 16,
   "role": "ruler",
   "group": null,
   "label_en": "Reign of Menahem (Israel)",
   "label_ta": null,
   "pairs_with": [],
   "scriptures": [],
   "source_docid": null,
   "note": null
  },
  {
   "event_id": "d1-0068",
   "order": 17,
   "role": "ruler",
   "group": null,
   "label_en": "Reign of Pekahiah (Israel)",
   "label_ta": null,
   "pairs_with": [],
   "scriptures": [],
   "source_docid": null,
   "note": null
  },
  {
   "event_id": "d1-0069",
   "order": 18,
   "role": "ruler",
   "group": null,
   "label_en": "Reign of Pekah (Israel)",
   "label_ta": null,
   "pairs_with": [],
   "scriptures": [],
   "source_docid": null,
   "note": null
  },
  {
   "event_id": "d1-0070",
   "order": 19,
   "role": "ruler",
   "group": null,
   "label_en": "Reign of Hoshea (Israel)",
   "label_ta": null,
   "pairs_with": [],
   "scriptures": [],
   "source_docid": null,
   "note": null
  }
 ],
 "notes": "Generated by scripts/build_series.py from existing records; sources are those of the member records."
}