{
 "id": "settlement-of-the-land",
 "title_en": "Settlement of the Promised Land",
 "title_ta": "வாக்குக் கொடுக்கப்பட்ட தேசத்தில் குடியேறுதல்",
 "kind": "chart_reproduction",
 "description_en": "NWT Appendix B6 shows the Promised Land divided among the tribes of Israel after the conquest, with the enclave cities of Simeon and Manasseh, the cities of refuge, and the twelve judges numbered at their locations. Its timeline marks the tribes receiving land after the conquest (1467 B.C.E.) and Saul’s anointing as king (1117 B.C.E.).",
 "description_ta": null,
 "highlight": false,
 "auto": false,
 "parent_series": null,
 "sources": [
  {
   "docid": "1001070226",
   "publication": "NWT Study Edition (nwtsty) App. B6",
   "title_en": "B6 Settlement of the Promised Land",
   "title_ta": "B6 வாக்குக் கொடுக்கப்பட்ட தேசத்தில் குடியேறுதல்",
   "url_en": "https://wol.jw.org/en/wol/d/r1/lp-e/1001070226",
   "url_ta": "https://wol.jw.org/ta/wol/d/r122/lp-tl/1001070226",
   "finder_url": "https://www.jw.org/finder?docid=1001070226&wtlocale=E",
   "par": null,
   "quote_en": null,
   "supports": null
  },
  {
   "docid": "1001061226",
   "publication": "New World Translation (nwt) App. B6",
   "title_en": "B6 Settlement of the Promised Land",
   "title_ta": "B6 வாக்குக் கொடுக்கப்பட்ட தேசத்தில் குடியேறுதல்",
   "url_en": "https://wol.jw.org/en/wol/d/r1/lp-e/1001061226",
   "url_ta": "https://wol.jw.org/ta/wol/d/r122/lp-tl/1001061226",
   "finder_url": "https://www.jw.org/finder?docid=1001061226&wtlocale=E",
   "par": null,
   "quote_en": null,
   "supports": null
  }
 ],
 "images": [
  {
   "url": "https://wol.jw.org/en/wol/mp/r1/lp-e/nwtsty/2026/96",
   "caption_en": "B6 Settlement of the Promised Land — printed-edition image",
   "caption_ta": "B6 வாக்குக் கொடுக்கப்பட்ட தேசத்தில் குடியேறுதல்",
   "source_docid": "1001070226",
   "kind": "map"
  },
  {
   "url": "https://wol.jw.org/ta/wol/mp/r122/lp-tl/nwtsty/2018/96",
   "caption_en": "Tamil edition: B6 Settlement of the Promised Land — printed-edition image",
   "caption_ta": "B6 வாக்குக் கொடுக்கப்பட்ட தேசத்தில் குடியேறுதல்",
   "source_docid": "1001070226",
   "kind": "map"
  },
  {
   "url": "https://wol.jw.org/en/wol/mp/r1/lp-e/nwtsty/2026/95",
   "caption_en": "B6 Settlement of the Promised Land — printed-edition image (SVG)",
   "caption_ta": "B6 வாக்குக் கொடுக்கப்பட்ட தேசத்தில் குடியேறுதல்",
   "source_docid": "1001070226",
   "kind": "map"
  },
  {
   "url": "https://wol.jw.org/ta/wol/mp/r122/lp-tl/nwtsty/2018/95",
   "caption_en": "Tamil edition: B6 Settlement of the Promised Land — printed-edition image (SVG)",
   "caption_ta": "B6 வாக்குக் கொடுக்கப்பட்ட தேசத்தில் குடியேறுதல்",
   "source_docid": "1001070226",
   "kind": "map"
  },
  {
   "url": "https://wol.jw.org/en/wol/mp/r1/lp-e/nwt/2013/109",
   "caption_en": "B6 Settlement of the Promised Land — printed-edition image",
   "caption_ta": "B6 வாக்குக் கொடுக்கப்பட்ட தேசத்தில் குடியேறுதல்",
   "source_docid": "1001061226",
   "kind": "map"
  },
  {
   "url": "https://wol.jw.org/ta/wol/mp/r122/lp-tl/nwt/2016/109",
   "caption_en": "Tamil edition: B6 Settlement of the Promised Land — printed-edition image",
   "caption_ta": "B6 வாக்குக் கொடுக்கப்பட்ட தேசத்தில் குடியேறுதல்",
   "source_docid": "1001061226",
   "kind": "map"
  }
 ],
 "groups": [
  {
   "id": "judges",
   "order": 1,
   "label_en": "Judges",
   "label_ta": "நியாயாதிபதிகள்",
   "span_id": "b2-0057",
   "attributes": {
    "legend_also": "Enclave Cities of Simeon; Enclave Cities of Manasseh; Cities of Refuge"
   },
   "note": "Numbered 1-12 on the map at each judge’s home or field of action."
  }
 ],
 "members": [
  {
   "event_id": "b2-0052",
   "order": 1,
   "role": "item",
   "group": null,
   "label_en": "Tribes receive land after conquest",
   "label_ta": "கைப்பற்றப்பட்ட தேசம் கோத்திரங்களுக்குப் பிரித்துக் கொடுக்கப்படுகிறது",
   "pairs_with": [],
   "scriptures": [],
   "source_docid": "1001070226",
   "note": "Shown on the timeline of the map."
  },
  {
   "event_id": "b2-0053",
   "order": 2,
   "role": "context",
   "group": null,
   "label_en": null,
   "label_ta": null,
   "pairs_with": [],
   "scriptures": [],
   "source_docid": "1001070226",
   "note": "Shiloh is on the map."
  },
  {
   "event_id": "b2-0057",
   "order": 3,
   "role": "context",
   "group": null,
   "label_en": null,
   "label_ta": null,
   "pairs_with": [],
   "scriptures": [],
   "source_docid": "1001070226",
   "note": "The period between the two timeline entries."
  },
  {
   "event_id": "b2-0058",
   "order": 4,
   "role": "item",
   "group": "judges",
   "label_en": "1 Othniel",
   "label_ta": "1 ஒத்னியேல்",
   "pairs_with": [],
   "scriptures": [],
   "source_docid": "1001070226",
   "note": "Numbered on the map legend ‘Judges’; no date printed."
  },
  {
   "event_id": "b2-0060",
   "order": 5,
   "role": "item",
   "group": "judges",
   "label_en": "2 Ehud",
   "label_ta": "2 ஏகூத்",
   "pairs_with": [],
   "scriptures": [],
   "source_docid": "1001070226",
   "note": "Numbered on the map legend ‘Judges’; no date printed."
  },
  {
   "event_id": "b2-0062",
   "order": 6,
   "role": "item",
   "group": "judges",
   "label_en": "3 Shamgar",
   "label_ta": "3 சம்கார்",
   "pairs_with": [],
   "scriptures": [],
   "source_docid": "1001070226",
   "note": "Numbered on the map legend ‘Judges’; no date printed."
  },
  {
   "event_id": "b2-0063",
   "order": 7,
   "role": "item",
   "group": "judges",
   "label_en": "4 Barak",
   "label_ta": "4 பாராக்",
   "pairs_with": [],
   "scriptures": [],
   "source_docid": "1001070226",
   "note": "Numbered on the map legend ‘Judges’; no date printed."
  },
  {
   "event_id": "b2-0065",
   "order": 8,
   "role": "item",
   "group": "judges",
   "label_en": "5 Gideon",
   "label_ta": "5 கிதியோன்",
   "pairs_with": [],
   "scriptures": [],
   "source_docid": "1001070226",
   "note": "Numbered on the map legend ‘Judges’; no date printed."
  },
  {
   "event_id": "b2-0067",
   "order": 9,
   "role": "item",
   "group": "judges",
   "label_en": "6 Tola",
   "label_ta": "6 தோலா",
   "pairs_with": [],
   "scriptures": [],
   "source_docid": "1001070226",
   "note": "Numbered on the map legend ‘Judges’; no date printed."
  },
  {
   "event_id": "b2-0068",
   "order": 10,
   "role": "item",
   "group": "judges",
   "label_en": "7 Jair",
   "label_ta": "7 யாவீர்",
   "pairs_with": [],
   "scriptures": [],
   "source_docid": "1001070226",
   "note": "Numbered on the map legend ‘Judges’; no date printed."
  },
  {
   "event_id": "b2-0071",
   "order": 11,
   "role": "item",
   "group": "judges",
   "label_en": "8 Jephthah",
   "label_ta": "8 யெப்தா",
   "pairs_with": [],
   "scriptures": [],
   "source_docid": "1001070226",
   "note": "Numbered on the map legend ‘Judges’; no date printed."
  },
  {
   "event_id": "b2-0072",
   "order": 12,
   "role": "item",
   "group": "judges",
   "label_en": "9 Ibzan",
   "label_ta": "9 இப்சான்",
   "pairs_with": [],
   "scriptures": [],
   "source_docid": "1001070226",
   "note": "Numbered on the map legend ‘Judges’; no date printed."
  },
  {
   "event_id": "b2-0073",
   "order": 13,
   "role": "item",
   "group": "judges",
   "label_en": "10 Elon",
   "label_ta": "10 ஏலோன்",
   "pairs_with": [],
   "scriptures": [],
   "source_docid": "1001070226",
   "note": "Numbered on the map legend ‘Judges’; no date printed."
  },
  {
   "event_id": "b2-0074",
   "order": 14,
   "role": "item",
   "group": "judges",
   "label_en": "11 Abdon",
   "label_ta": "11 அப்தோன்",
   "pairs_with": [],
   "scriptures": [],
   "source_docid": "1001070226",
   "note": "Numbered on the map legend ‘Judges’; no date printed."
  },
  {
   "event_id": "b2-0075",
   "order": 15,
   "role": "item",
   "group": "judges",
   "label_en": "12 Samson",
   "label_ta": "12 சிம்சோன்",
   "pairs_with": [],
   "scriptures": [],
   "source_docid": "1001070226",
   "note": "Numbered on the map legend ‘Judges’; no date printed."
  },
  {
   "event_id": "b3-0001",
   "order": 16,
   "role": "item",
   "group": null,
   "label_en": "Saul anointed as king",
   "label_ta": "சவுல் ராஜாவாக அபிஷேகம் செய்யப்படுகிறார்",
   "pairs_with": [],
   "scriptures": [],
   "source_docid": "1001070226",
   "note": "Shown on the timeline of the map."
  }
 ],
 "notes": "‘Item’ = the map’s timeline entries and the twelve judges numbered on the map (B6 prints no dates for the judges; their records keep jw.org’s ‘date not stated’ precision). ‘Context’ = records for the settlement period."
}