{
 "id": "watch-tower-presidents",
 "title_en": "Presidents of the Watch Tower Society",
 "title_ta": null,
 "kind": "succession",
 "description_en": "The presidents of the Watch Tower Bible and Tract Society from C. T. Russell onward.",
 "description_ta": null,
 "highlight": false,
 "auto": true,
 "parent_series": null,
 "sources": [
  {
   "docid": "1101993046",
   "publication": "Jehovah’s Witnesses—Proclaimers of God’s Kingdom (jv p. 718-p. 723 par. 19)",
   "title_en": "Noteworthy Events in the Modern-day History of Jehovah’s Witnesses",
   "title_ta": null,
   "url_en": "https://wol.jw.org/en/wol/d/r1/lp-e/1101993046",
   "url_ta": null,
   "finder_url": "https://www.jw.org/finder?docid=1101993046&wtlocale=E"
  },
  {
   "docid": "1993207",
   "publication": "The Watchtower (w93 3/15 pp. 31-32)",
   "title_en": "Rewarded With “the Crown of Life”",
   "title_ta": null,
   "url_en": "https://wol.jw.org/en/wol/d/r1/lp-e/1993207",
   "url_ta": null,
   "finder_url": "https://www.jw.org/finder?docid=1993207&wtlocale=E"
  },
  {
   "docid": "1102018055",
   "publication": "Examining the Scriptures Daily—2018 (es18 pp. 57-67)",
   "title_en": "June",
   "title_ta": "ஜூன்",
   "url_en": "https://wol.jw.org/en/wol/d/r1/lp-e/1102018055",
   "url_ta": "https://wol.jw.org/ta/wol/d/r122/lp-tl/1102018055",
   "finder_url": "https://www.jw.org/finder?docid=1102018055&wtlocale=E"
  }
 ],
 "images": [],
 "groups": [],
 "members": [
  {
   "event_id": "b12-0063",
   "order": 1,
   "role": "ruler",
   "group": null,
   "label_en": "C. T. Russell, first president of the Watch Tower Society",
   "label_ta": null,
   "pairs_with": [],
   "scriptures": [],
   "source_docid": null,
   "note": null
  },
  {
   "event_id": "b12-0072",
   "order": 2,
   "role": "ruler",
   "group": null,
   "label_en": "J. F. Rutherford, second president of the Watch Tower Society",
   "label_ta": null,
   "pairs_with": [],
   "scriptures": [],
   "source_docid": null,
   "note": null
  },
  {
   "event_id": "b12-0087",
   "order": 3,
   "role": "ruler",
   "group": null,
   "label_en": "N. H. Knorr, third president of the Watch Tower Society",
   "label_ta": null,
   "pairs_with": [],
   "scriptures": [],
   "source_docid": null,
   "note": null
  },
  {
   "event_id": "b12-0097",
   "order": 4,
   "role": "ruler",
   "group": null,
   "label_en": "F. W. Franz, fourth president of the Watch Tower Society",
   "label_ta": null,
   "pairs_with": [],
   "scriptures": [],
   "source_docid": null,
   "note": null
  },
  {
   "event_id": "b12-0100",
   "order": 5,
   "role": "ruler",
   "group": null,
   "label_en": "M. G. Henschel, fifth president of the Watch Tower Society",
   "label_ta": null,
   "pairs_with": [],
   "scriptures": [],
   "source_docid": null,
   "note": null
  }
 ],
 "notes": "Generated by scripts/build_series.py from existing records; sources are those of the member records."
}